{
  "experiment_id": "NCT06312501",
  "domain": "Cardiology",
  "target_disease": "Heart Failure, Patient Empowerment, Cardiac Failure",
  "tested_intervention": {
    "type": "Device",
    "name": "Satelia®Cardio",
    "dosage": "See ClinicalTrials.gov record"
  },
  "hypothesis": "DRAFT - fill in based on study record.",
  "outcome": "Trial status: COMPLETED. Status: COMPLETED. Completed trials require manual results-section review before assuming a negative outcome -- see docs/CURATION_GUIDE.md. Human curator must confirm whether this represents a genuine negative/null result before merging.",
  "methodology_summary": "OBSERVATIONAL",
  "researcher_orcid": "0000-0000-0000-0000",
  "institution_type": "Pharmaceutical Company",
  "date_concluded": "2022-12-31",
  "source_type": "public_database_extraction",
  "source_url": "https://clinicaltrials.gov/study/NCT06312501",
  "license": "CC0-1.0",
  "contact_email_optional": "",
  "keywords": [
    "draft",
    "needs_review",
    "clinicaltrials_gov",
    "confidence_low"
  ]
}