{
  "experiment_id": "NCT03999736",
  "domain": "Psychiatry",
  "target_disease": "Major Depressive Disorder, Anxiety",
  "tested_intervention": {
    "type": "Device",
    "name": "transcranial direct current stimulation using a Soterix mini-CT device",
    "dosage": "See ClinicalTrials.gov record"
  },
  "hypothesis": "DRAFT - fill in based on study record.",
  "outcome": "Trial status: TERMINATED. Status: TERMINATED. Reason given: 'Covid paused recruitment after the first participant was recruited. Subsequently, key study staff moved institution meaning it was no longer possible to run the trial.'. (Downgraded: reason appears administrative, not scientific.) Human curator must confirm whether this represents a genuine negative/null result before merging.",
  "methodology_summary": "INTERVENTIONAL",
  "researcher_orcid": "0000-0000-0000-0000",
  "institution_type": "Other",
  "date_concluded": "2021-02-09",
  "source_type": "public_database_extraction",
  "source_url": "https://clinicaltrials.gov/study/NCT03999736",
  "license": "CC0-1.0",
  "contact_email_optional": "",
  "keywords": [
    "draft",
    "needs_review",
    "clinicaltrials_gov",
    "confidence_low",
    "institution_unconfirmed"
  ]
}