{
  "experiment_id": "NCT03384043",
  "domain": "Neurology",
  "target_disease": "Alzheimer Disease, Cognitive Impairment, Mild, Dementia, Mild",
  "tested_intervention": {
    "type": "Behavioral",
    "name": "Smartphone Personal Assistant",
    "dosage": "See ClinicalTrials.gov record"
  },
  "hypothesis": "DRAFT - fill in based on study record.",
  "outcome": "Trial status: COMPLETED. Status: COMPLETED. Completed trials require manual results-section review before assuming a negative outcome -- see docs/CURATION_GUIDE.md. Human curator must confirm whether this represents a genuine negative/null result before merging.",
  "methodology_summary": "INTERVENTIONAL",
  "researcher_orcid": "0000-0000-0000-0000",
  "institution_type": "Other",
  "date_concluded": "2020-02-28",
  "source_type": "public_database_extraction",
  "source_url": "https://clinicaltrials.gov/study/NCT03384043",
  "license": "CC0-1.0",
  "contact_email_optional": "",
  "keywords": [
    "draft",
    "needs_review",
    "clinicaltrials_gov",
    "confidence_low",
    "institution_unconfirmed"
  ]
}