{
  "experiment_id": "NCT01364324",
  "domain": "Oncology",
  "target_disease": "Tuberculosis, Tuberculosis, Pulmonary, Early Gastric Cancer",
  "tested_intervention": {
    "type": "Drug",
    "name": "standard first line anti-TB drugs",
    "dosage": "See ClinicalTrials.gov record"
  },
  "hypothesis": "DRAFT - fill in based on study record.",
  "outcome": "Trial status: COMPLETED. Status: COMPLETED. Completed trials require manual results-section review before assuming a negative outcome -- see docs/CURATION_GUIDE.md. Human curator must confirm whether this represents a genuine negative/null result before merging.",
  "methodology_summary": "OBSERVATIONAL",
  "researcher_orcid": "0000-0000-0000-0000",
  "institution_type": "Government Institute",
  "date_concluded": "2020-06",
  "source_type": "public_database_extraction",
  "source_url": "https://clinicaltrials.gov/study/NCT01364324",
  "license": "CC0-1.0",
  "contact_email_optional": "",
  "keywords": [
    "draft",
    "needs_review",
    "clinicaltrials_gov",
    "confidence_low"
  ]
}