{
  "experiment_id": "NCT00453934",
  "domain": "Endocrinology",
  "target_disease": "Type 1 Diabetes, Type 2 Diabetes",
  "tested_intervention": {
    "type": "Device",
    "name": "h-Patch",
    "dosage": "See ClinicalTrials.gov record"
  },
  "hypothesis": "DRAFT - fill in based on study record.",
  "outcome": "Trial status: TERMINATED. Status: TERMINATED. Reason given: 'Endpoint no longer deemed meaningful'. Human curator must confirm whether this represents a genuine negative/null result before merging.",
  "methodology_summary": "INTERVENTIONAL",
  "researcher_orcid": "0000-0000-0000-0000",
  "institution_type": "Pharmaceutical Company",
  "date_concluded": "2007-09",
  "source_type": "public_database_extraction",
  "source_url": "https://clinicaltrials.gov/study/NCT00453934",
  "license": "CC0-1.0",
  "contact_email_optional": "",
  "keywords": [
    "draft",
    "needs_review",
    "clinicaltrials_gov",
    "confidence_high"
  ]
}