{
  "experiment_id": "auto_generated_or_unique_id",
  "domain": "Oncology",
  "target_disease": "Breast Cancer (MCF-7 cells)",
  "tested_intervention": {
    "type": "Molecule",
    "name": "Compound_XYZ_123",
    "dosage": "50 mg/ml"
  },
  "hypothesis": "Compound_XYZ_123 will induce apoptosis in MCF-7 cells.",
  "outcome": "No significant difference in cell viability compared to control group after 48 hours.",
  "methodology_summary": "In vitro testing, MTT assay.",
  "researcher_orcid": "0000-0000-0000-0000",
  "institution_type": "University Research Lab",
  "date_concluded": "2025-11-15",
  "source_type": "original_submission",
  "source_url": "",
  "license": "CC0-1.0",
  "contact_email_optional": "",
  "keywords": ["negative result", "oncology", "in vitro"]
}
