{
  "experiment_id": "NCT01893255",
  "domain": "Immunology",
  "target_disease": "Rheumatoid Arthritis",
  "tested_intervention": {
    "type": "Other",
    "name": "Unknown",
    "dosage": "See ClinicalTrials.gov record"
  },
  "hypothesis": "DRAFT - fill in based on study record.",
  "outcome": "Trial status: WITHDRAWN. Status: WITHDRAWN. Human curator must confirm whether this represents a genuine negative/null result before merging.",
  "methodology_summary": "OBSERVATIONAL",
  "researcher_orcid": "0000-0000-0000-0000",
  "institution_type": "Pharmaceutical Company",
  "date_concluded": "2014-06",
  "source_type": "public_database_extraction",
  "source_url": "https://clinicaltrials.gov/study/NCT01893255",
  "license": "CC0-1.0",
  "contact_email_optional": "",
  "keywords": [
    "draft",
    "needs_review",
    "clinicaltrials_gov",
    "confidence_high"
  ]
}