{
  "experiment_id": "NCT00437164",
  "domain": "Endocrinology",
  "target_disease": "Type 2 Diabetes Mellitus, Diabetes Mellitus, Type 2",
  "tested_intervention": {
    "type": "Drug",
    "name": "Insulin",
    "dosage": "See ClinicalTrials.gov record"
  },
  "hypothesis": "DRAFT - fill in based on study record.",
  "outcome": "Trial status: TERMINATED. Status: TERMINATED. Reason given: 'Company decision not related to safety.'. (Downgraded: reason appears administrative, not scientific.) Human curator must confirm whether this represents a genuine negative/null result before merging.",
  "methodology_summary": "INTERVENTIONAL",
  "researcher_orcid": "0000-0000-0000-0000",
  "institution_type": "Pharmaceutical Company",
  "date_concluded": "2006-11",
  "source_type": "public_database_extraction",
  "source_url": "https://clinicaltrials.gov/study/NCT00437164",
  "license": "CC0-1.0",
  "contact_email_optional": "",
  "keywords": [
    "draft",
    "needs_review",
    "clinicaltrials_gov",
    "confidence_low"
  ]
}