{
  "experiment_id": "NCT01613196",
  "domain": "Infectious Disease",
  "target_disease": "Extrapulmonary Tuberculosis, Lymph Node Tuberculosis, Bone Tuberculosis",
  "tested_intervention": {
    "type": "Other",
    "name": "Positron Emission Tomography with 18F-Fluoro-deoxy-glucose",
    "dosage": "See ClinicalTrials.gov record"
  },
  "hypothesis": "DRAFT - fill in based on study record.",
  "outcome": "Trial status: COMPLETED. Status: COMPLETED. Completed trials require manual results-section review before assuming a negative outcome -- see docs/CURATION_GUIDE.md. Human curator must confirm whether this represents a genuine negative/null result before merging.",
  "methodology_summary": "INTERVENTIONAL",
  "researcher_orcid": "0000-0000-0000-0000",
  "institution_type": "Other",
  "date_concluded": "2018-03",
  "source_type": "public_database_extraction",
  "source_url": "https://clinicaltrials.gov/study/NCT01613196",
  "license": "CC0-1.0",
  "contact_email_optional": "",
  "keywords": [
    "draft",
    "needs_review",
    "clinicaltrials_gov",
    "confidence_low",
    "institution_unconfirmed"
  ]
}