{
  "experiment_id": "NCT01705834",
  "domain": "Immunology",
  "target_disease": "Arthritis, Rheumatoid",
  "tested_intervention": {
    "type": "Other",
    "name": "Unknown",
    "dosage": "See ClinicalTrials.gov record"
  },
  "hypothesis": "DRAFT - fill in based on study record.",
  "outcome": "Trial status: WITHDRAWN. Status: WITHDRAWN. Reason given: 'The study protocol has been replaced with a two-glove protocol NCT02026245'. Human curator must confirm whether this represents a genuine negative/null result before merging.",
  "methodology_summary": "OBSERVATIONAL",
  "researcher_orcid": "0000-0000-0000-0000",
  "institution_type": "Other",
  "date_concluded": "",
  "source_type": "public_database_extraction",
  "source_url": "https://clinicaltrials.gov/study/NCT01705834",
  "license": "CC0-1.0",
  "contact_email_optional": "",
  "keywords": [
    "draft",
    "needs_review",
    "clinicaltrials_gov",
    "confidence_high",
    "institution_unconfirmed"
  ]
}