{
  "experiment_id": "NCT00159146",
  "domain": "Psychiatry",
  "target_disease": "Major Depression",
  "tested_intervention": {
    "type": "Drug",
    "name": "Pindolol and venlafaxin",
    "dosage": "See ClinicalTrials.gov record"
  },
  "hypothesis": "DRAFT - fill in based on study record.",
  "outcome": "Trial status: TERMINATED. Status: TERMINATED. Reason given: 'lack of participants fulfilling inclusion criteria'. Human curator must confirm whether this represents a genuine negative/null result before merging.",
  "methodology_summary": "INTERVENTIONAL",
  "researcher_orcid": "0000-0000-0000-0000",
  "institution_type": "Other",
  "date_concluded": "2007-09",
  "source_type": "public_database_extraction",
  "source_url": "https://clinicaltrials.gov/study/NCT00159146",
  "license": "CC0-1.0",
  "contact_email_optional": "",
  "keywords": [
    "draft",
    "needs_review",
    "clinicaltrials_gov",
    "confidence_high",
    "institution_unconfirmed"
  ]
}